{
  "contract": "grid.bybit-funding-history-request/v1",
  "job_id": "funding-2026-07-b05-10x7-scale",
  "series": [
    {"symbol": "BANDUSDT", "start_ms": 1782864000000, "end_ms": 1783468740000},
    {"symbol": "BTCUSDT", "start_ms": 1782864000000, "end_ms": 1783468740000},
    {"symbol": "CHZUSDT", "start_ms": 1782864000000, "end_ms": 1783468740000},
    {"symbol": "EGLDUSDT", "start_ms": 1782864000000, "end_ms": 1783468740000},
    {"symbol": "FILUSDT", "start_ms": 1782864000000, "end_ms": 1783468740000},
    {"symbol": "IMXUSDT", "start_ms": 1782864000000, "end_ms": 1783468740000},
    {"symbol": "KAVAUSDT", "start_ms": 1782864000000, "end_ms": 1783468740000},
    {"symbol": "QNTUSDT", "start_ms": 1782864000000, "end_ms": 1783468740000},
    {"symbol": "UNIUSDT", "start_ms": 1782864000000, "end_ms": 1783468740000},
    {"symbol": "WOOUSDT", "start_ms": 1782864000000, "end_ms": 1783468740000}
  ],
  "page_span_minutes": 10080,
  "page_limit": 200,
  "workers": 24,
  "target_rps": 15,
  "max_attempts": 3,
  "max_http_requests": 60
}
