{"contract":"grid.bybit-funding-history-request/v1","job_id":"funding-2026-05-b05-50x90-scale","series":[{"symbol":"10000SATSUSDT","start_ms":1777593600000,"end_ms":1780271940000},{"symbol":"ANIMEUSDT","start_ms":1777593600000,"end_ms":1780271940000},{"symbol":"APEUSDT","start_ms":1777593600000,"end_ms":1780271940000},{"symbol":"ARCUSDT","start_ms":1777593600000,"end_ms":1780271940000},{"symbol":"BANUSDT","start_ms":1777593600000,"end_ms":1780271940000},{"symbol":"BANDUSDT","start_ms":1777593600000,"end_ms":1780271940000},{"symbol":"BIGTIMEUSDT","start_ms":1777593600000,"end_ms":1780271940000},{"symbol":"BOMEUSDT","start_ms":1777593600000,"end_ms":1780271940000},{"symbol":"BTCUSDT","start_ms":1777593600000,"end_ms":1780271940000},{"symbol":"CHILLGUYUSDT","start_ms":1777593600000,"end_ms":1780271940000},{"symbol":"CHZUSDT","start_ms":1777593600000,"end_ms":1780271940000},{"symbol":"CLANKERUSDT","start_ms":1777593600000,"end_ms":1780271940000},{"symbol":"COREUSDT","start_ms":1777593600000,"end_ms":1780271940000},{"symbol":"CVCUSDT","start_ms":1777593600000,"end_ms":1780271940000},{"symbol":"CVXUSDT","start_ms":1777593600000,"end_ms":1780271940000},{"symbol":"EGLDUSDT","start_ms":1777593600000,"end_ms":1780271940000},{"symbol":"EPICUSDT","start_ms":1777593600000,"end_ms":1780271940000},{"symbol":"FHEUSDT","start_ms":1777593600000,"end_ms":1780271940000},{"symbol":"FILUSDT","start_ms":1777593600000,"end_ms":1780271940000},{"symbol":"IMXUSDT","start_ms":1777593600000,"end_ms":1780271940000},{"symbol":"KAVAUSDT","start_ms":1777593600000,"end_ms":1780271940000},{"symbol":"MNTUSDT","start_ms":1777593600000,"end_ms":1780271940000},{"symbol":"MYXUSDT","start_ms":1777593600000,"end_ms":1780271940000},{"symbol":"ONTUSDT","start_ms":1777593600000,"end_ms":1780271940000},{"symbol":"PARTIUSDT","start_ms":1777593600000,"end_ms":1780271940000},{"symbol":"PIPPINUSDT","start_ms":1777593600000,"end_ms":1780271940000},{"symbol":"POLUSDT","start_ms":1777593600000,"end_ms":1780271940000},{"symbol":"QNTUSDT","start_ms":1777593600000,"end_ms":1780271940000},{"symbol":"RENDERUSDT","start_ms":1777593600000,"end_ms":1780271940000},{"symbol":"SEIUSDT","start_ms":1777593600000,"end_ms":1780271940000},{"symbol":"SLPUSDT","start_ms":1777593600000,"end_ms":1780271940000},{"symbol":"SONICUSDT","start_ms":1777593600000,"end_ms":1780271940000},{"symbol":"SOPHUSDT","start_ms":1777593600000,"end_ms":1780271940000},{"symbol":"SQDUSDT","start_ms":1777593600000,"end_ms":1780271940000},{"symbol":"SSVUSDT","start_ms":1777593600000,"end_ms":1780271940000},{"symbol":"STEEMUSDT","start_ms":1777593600000,"end_ms":1780271940000},{"symbol":"SUIUSDT","start_ms":1777593600000,"end_ms":1780271940000},{"symbol":"TAIKOUSDT","start_ms":1777593600000,"end_ms":1780271940000},{"symbol":"TNSRUSDT","start_ms":1777593600000,"end_ms":1780271940000},{"symbol":"UNIUSDT","start_ms":1777593600000,"end_ms":1780271940000},{"symbol":"USD1USDT","start_ms":1777593600000,"end_ms":1780271940000},{"symbol":"USELESSUSDT","start_ms":1777593600000,"end_ms":1780271940000},{"symbol":"USTCUSDT","start_ms":1777593600000,"end_ms":1780271940000},{"symbol":"VELOUSDT","start_ms":1777593600000,"end_ms":1780271940000},{"symbol":"WOOUSDT","start_ms":1777593600000,"end_ms":1780271940000},{"symbol":"XMRUSDT","start_ms":1777593600000,"end_ms":1780271940000},{"symbol":"XVGUSDT","start_ms":1777593600000,"end_ms":1780271940000},{"symbol":"ZEREBROUSDT","start_ms":1777593600000,"end_ms":1780271940000},{"symbol":"ZETAUSDT","start_ms":1777593600000,"end_ms":1780271940000},{"symbol":"ZROUSDT","start_ms":1777593600000,"end_ms":1780271940000}],"page_span_minutes":10080,"page_limit":200,"workers":24,"target_rps":15,"max_attempts":3,"max_http_requests":900}
